{
  "id": "6c70b3ef-ccff-4707-b3d9-6e62e4110836",
  "source": "Climate change",
  "source_type": "direct_text",
  "text": "Climate change",
  "summary": "Search query: Climate change\n\nClimate change is a critical issue characterized by long-term changes in temperature, precipitation patterns, and other atmospheric conditions on Earth. This phenomenon has been largely attributed to human activities, particularly the burning of fossil fuels such as coal, oil, and natural gas, which increase the concentration of greenhouse gases (GHGs) like carbon dioxide (CO2) and methane in the atmosphere. These gases trap heat and lead to a warming effect known as the greenhouse effect, contributing to global warming and broader climatic disruptions.\n\nMain themes in the discourse on climate change include the scientific understanding and evidence supporting its existence and human influence, the impacts of climate change on natural and human systems, and the policies and measures needed to mitigate its effects. Scientists have observed rising global temperatures, melting ice caps and glaciers, rising sea levels, and increased frequency and severity of extreme weather events as indicators of climate change. Furthermore, discussions often touch on the economic, social, and environmental implications, with debates on balancing development and sustainability.\n\nKey entities in this context are the Intergovernmental Panel on Climate Change (IPCC), an organization that synthesizes global scientific knowledge on climate change, and the United Nations Framework Convention on Climate Change (UNFCCC), which facilitates international climate negotiations, including the Paris Agreement. Governments, environmental NGOs, companies, and individuals all play roles in addressing climate change through policy, research, and lifestyle changes.\n\nThe temporal focus of climate change discourse spans from the industrial revolution, which marked significant increases in GHG emissions, to the present, where immediate action is advocated to curb emissions and adapt to inevitable changes. Future projections emphasize the need for comprehensive policies to limit global warming to below 1.5-2 degrees Celsius above pre-industrial levels to avoid catastrophic consequences.\n\nGeographically, climate change is a global phenomenon but has diverse regional impacts. Low-lying areas and small island nations are particularly vulnerable to sea-level rise, while other regions may experience extreme weather events, such as hurricanes in the Atlantic or droughts in sub-Saharan Africa.\n\nThe overall sentiment surrounding climate change is urgent and often pessimistic, given the challenges posed by requisite global cooperation and the already visible impacts on ecosystems and communities. This urgency is tempered by hope driven by technological advancements, renewable energy adoption, and increasing public awareness and advocacy.\n\nSignificant data points often cited include the annual global CO2 emissions exceeding 40 billion metric tons, the rise in global average temperatures by about 1.1 degrees Celsius since the late 19th century, and projections that without significant emissions reductions, temperatures could rise by 3-4 degrees Celsius by 2100.",
  "sentiment": {
    "sentiment": "negative",
    "score": -0.6,
    "confidence": 0.9,
    "rationale": "The text conveys a predominantly negative sentiment due to the urgent tone that emphasizes the serious and challenging impacts of climate change, such as rising temperatures, melting ice caps, and extreme weather events. It highlights the substantial human influence on climate change, particularly through greenhouse gas emissions, creating an overall pessimistic view of the situation. The necessity for immediate global cooperation and action underscores the current severity and complexity of the issue. However, a faint sense of hope is mentioned through technological advancements and increased public awareness, tempering the negativity slightly."
  },
  "metadata": {
    "topics": [
      "climate change",
      "greenhouse gases",
      "global warming",
      "climate policy",
      "sustainability",
      "renewable energy",
      "extreme weather events"
    ],
    "regions": [
      "global",
      "low-lying areas",
      "small island nations",
      "Atlantic",
      "sub-Saharan Africa"
    ],
    "entities": [
      "Intergovernmental Panel on Climate Change (IPCC)",
      "United Nations Framework Convention on Climate Change (UNFCCC)",
      "Paris Agreement",
      "governments",
      "environmental NGOs",
      "companies",
      "individuals"
    ],
    "commodities": [
      "coal",
      "oil",
      "natural gas",
      "renewable energy"
    ],
    "temporal_details": {
      "time_period": [
        "industrial revolution",
        "present",
        "2100"
      ],
      "recency": "current"
    },
    "topic_details": {
      "main_topics": [
        "climate change",
        "global warming",
        "climate policy"
      ],
      "subtopics": [
        "greenhouse gases",
        "sustainability",
        "extreme weather events",
        "economic implications",
        "technological advancements"
      ]
    }
  },
  "timestamp": "2025-04-09T01:39:51.454635"
}