{
  "id": "3d51f638-308b-4c87-8c94-3a05026f0287",
  "source": "artificial intelligence\n",
  "source_type": "direct_text",
  "text": "artificial intelligence",
  "summary": "Search query: artificial intelligence\n\n\nArtificial intelligence (AI) is a rapidly advancing field within technology that focuses on creating systems able to perform tasks typically requiring human intelligence. This includes areas such as visual perception, speech recognition, decision-making, and language translation. AI has evolved from theoretical concepts to practical applications that impact various sectors including healthcare, finance, transportation, and entertainment. Over recent years, AI technologies have increasingly embedded themselves into everyday life, enhancing efficiency and empowering innovation across industries. Key developments include advancements in machine learning, neural networks, and natural language processing.\n\nThe main themes in AI revolve around automation, efficiency, and enhancement of human capabilities. Arguments often presented include the transformative potential of AI to reshape industries and society and the ethical considerations of its deployment, particularly concerning privacy, job displacement, and decision-making autonomy. Proponents argue for the benefits of AI in improving productivity and solving complex problems, while critics warn about risks, including possible bias in AI algorithms and the need for regulation to prevent misuse.\n\nProminent entities in the AI landscape include tech giants like Google, IBM, Microsoft, and Tesla, along with newer companies such as OpenAI. Influential figures like Elon Musk, Sundar Pichai, and dedicated AI researchers often drive the conversation around AI's future. The temporal context of AI is highly dynamic, with discussions ranging from its historical development in the 20th century – influenced by pioneers like Alan Turing – to future projections about AI singularity and its potential implications for human society.\n\nGeographically, AI development is concentrated in regions with robust tech ecosystems, such as the United States, China, and parts of Europe, all of which compete vigorously in AI research and implementation. The sentiment surrounding AI is mixed; it is both optimistic about its vast potential to enhance human life and cautious about its ethical, social, and economic impacts.\n\nKey statistics reveal that AI investments have surged, with AI market revenue expected to reach into the hundreds of billions of dollars in the near future. Studies indicate that AI can potentially contribute trillions to the global economy by enhancing productivity and bringing innovations to various sectors. Overall, AI is seen as both an opportunity and a challenge, requiring careful consideration and balanced regulatory measures to ensure that its development benefits society.",
  "sentiment": {
    "sentiment": "positive",
    "score": 0.6,
    "confidence": 0.85,
    "rationale": "The sentiment of the text is largely positive, as it highlights the significant advancements and potential benefits of artificial intelligence (AI) across various sectors such as healthcare, finance, transportation, and entertainment. The text emphasizes AI's role in enhancing efficiency and driving innovation, reflecting optimism about its capabilities to improve productivity and solve complex problems. Moreover, it mentions increased investments and economic contributions expected from AI, supporting a positive outlook. However, a balanced view is presented with the mention of ethical considerations, such as privacy issues and job displacement, which introduces a note of caution and tempers the sentiment. These elements contribute to an overall positive sentiment, with slightly moderated enthusiasm due to the mention of potential risks and the necessity for regulation."
  },
  "metadata": {
    "topics": [
      "artificial intelligence",
      "automation",
      "machine learning",
      "neural networks",
      "natural language processing",
      "ethics of AI",
      "AI regulation"
    ],
    "regions": [
      "United States",
      "China",
      "Europe"
    ],
    "entities": [
      "Google",
      "IBM",
      "Microsoft",
      "Tesla",
      "OpenAI",
      "Elon Musk",
      "Sundar Pichai",
      "Alan Turing"
    ],
    "commodities": [
      "AI technologies",
      "speech recognition",
      "language translation",
      "AI market revenue",
      "AI algorithms"
    ],
    "temporal_details": {
      "time_period": [
        "20th century",
        "recent years",
        "near future"
      ],
      "recency": "current"
    },
    "topic_details": {
      "main_topics": [
        "AI advancements",
        "impacts on industries",
        "ethical considerations"
      ],
      "subtopics": [
        "decision-making",
        "enhancement of human capabilities",
        "job displacement",
        "AI investments",
        "AI singularity"
      ]
    }
  },
  "timestamp": "2025-04-09T02:03:00.361663"
}