{
  "id": "1f37aae0-335d-47a1-8579-693ca0e6b763",
  "source": "Direct Text Input",
  "source_type": "direct_text",
  "text": "New tariff policy set by donald trump",
  "summary": "The content you\u2019ve provided relates to a political move made by former U.S. President Donald Trump during his tenure. This analysis will dissect various components of the news regarding Trump's tariff policy.\n\n### Main Events or Developments Reported\n\nThe primary development reported is the implementation of a new tariff policy by Donald Trump. This policy likely includes imposing duties on imported goods, which might be aimed at specific countries or sectors. Trump's administration often focused on tariffs as a tool to balance trade deficits, support domestic industries, and at times to exert geopolitical pressure.\n\n### Perspectives or Biases in the Reporting\n\nTo accurately assess biases, one would need to evaluate the tone, language, and presentation used in the original news piece. Common biases may include:\n\n1. **Pro-Trade Policy Stance**: If the reporting leans towards viewing tariffs as protective measures for domestic industries, sustaining employment, or correcting trade imbalances.\n2. **Anti-Tariff Stance**: Alternatively, the reporting might underscore the negative consequences, such as increased consumer prices, retaliatory tariffs from trading partners, and potential disruptions in global supply chains.\n\nThe perspectives taken could align with different political ideologies or economic theories, influencing public perception and stakeholder responses.\n\n### Key Persons, Organizations, or Entities Involved\n\n- **Donald Trump**: The former U.S. President, and the central figure behind the tariff policy. His administration's trade policies were often characterized by a protectionist outlook.\n- **U.S. Trade Representative or the Commerce Department**: Likely involved in the implementation and negotiation of tariff policies.\n- **Impacted Countries**: These might include China, Canada, the European Union, and other trading partners who are significant sources of imports to the United States.\n- **U.S. Domestic Industries**: Particularly manufacturing, steel, and agriculture, which are often highlighted when discussing tariffs.\n- **International Trade Organizations**: Bodies like the World Trade Organization (WTO) may also play a role in adjudicating disputes arising from these tariffs.\n\n### Geographical Focus of the Content\n\nThe geographical focus is dual:\n\n- **Domestic (United States)**: The policy primarily affects U.S. economic dynamics, particularly concerning domestic industry and consumer behavior.\n- **International**: Countries directly affected by the new tariffs, potentially leading to diplomatic and economic responses that could have global repercussions.\n\n### Timing of Events (Current, Historical, Future Predictions)\n\nGiven that Donald Trump\u2019s presidency spanned from January 2017 to January 2021, this new tariff policy would historically fall within this period.\n\n- **Historical Context**: Historically, Trump's tariff implementations, including tariffs on Chinese goods under Section 301 of the Trade Act of 1974, were significant. He also renegotiated the North American Free Trade Agreement (NAFTA) into the United States-Mexico-Canada Agreement (USMCA).\n- **Future Predictions**: At the time, predictions might have speculated on long-term impacts such as potential global trade wars, shifts in manufacturing locations, or changes in international trade partnerships.\n\n### Deep Insights\n\nThe introduction of a new tariff policy by Donald Trump was emblematic of his \u201cAmerica First\u201d strategy, aiming to bolster U.S. industries and correct perceived imbalances. This approach highlighted deep rifts between economic nationalism and globalism\u2014a core attribute of Trump's broader economic strategy. Such moves also signaled a paradigmatic shift in U.S. trade policy that diverged from prior administrations, seeking to renegotiate what was deemed unfair trade practices directly. The electoral implications were significant, as these policies resonated with key voter bases in industrial and economically affected regions. Analyzing his tariff strategy offers insight into how economic policy intertwines with political strategy and international relations on a significant scale.",
  "sentiment": {
    "sentiment": "neutral",
    "score": 0,
    "confidence": 0.8,
    "rationale": "The sentiment is classified as neutral because the analysis provides a balanced view of Trump's tariff policy, discussing both potential benefits for domestic industries and drawbacks such as increased consumer prices. It presents the facts without strong bias or emotional language, focusing on the economic and geopolitical implications of the policy."
  },
  "metadata": {
    "topics": [
      "tariff policy",
      "trade deficits",
      "domestic industries",
      "geopolitical pressure",
      "economic nationalism"
    ],
    "regions": [
      "United States",
      "China",
      "Canada",
      "European Union"
    ],
    "commodities": [
      "manufacturing",
      "steel",
      "agriculture"
    ],
    "topic_details": {
      "main_topics": [
        "tariff policy",
        "trade deficits",
        "domestic industries"
      ],
      "subtopics": [
        "geopolitical pressure",
        "economic nationalism"
      ]
    },
    "geographical_details": {
      "countries": [
        "United States",
        "China",
        "Canada"
      ],
      "regions": [
        "European Union"
      ],
      "cities": []
    },
    "commodity_details": {
      "resources": [
        "manufacturing",
        "steel",
        "agriculture"
      ],
      "products": [],
      "financial_instruments": []
    },
    "temporal_details": {
      "time_period": [
        "January 2017 to January 2021",
        "Section 301 of the Trade Act of 1974"
      ],
      "key_dates": []
    },
    "entities": [
      "Donald Trump",
      "U.S. Trade Representative",
      "Commerce Department",
      "World Trade Organization",
      "United States-Mexico-Canada Agreement"
    ]
  },
  "timestamp": "2025-04-09T00:08:43.451484"
}