{
  "id": "513341b3-ed48-4ab3-a045-1736f032f2a6",
  "source": "Direct Text Input",
  "source_type": "direct_text",
  "text": "Swamp Izzo",
  "summary": "To perform a comprehensive analysis of the content titled \"Swamp Izzo,\" it's essential to delve into potential interpretations and extrapolate insights even when explicit details are sparse. Given the unknown nature of this content, the analysis will focus on hypothetical scenarios, possible interpretations, and broader thematic exploration:\n\n### Main Topics and Themes\n\n1. **Environmental and Ecological Focus:**\n   - The term \"Swamp\" suggests a natural, biodiverse environment, which might imply themes related to ecology, conservation, or environmental issues.\n   - Such themes often encompass discussions about biodiversity, ecological preservation, or challenges like invasive species and climate change impacts.\n\n2. **Cultural or Regional Significance:**\n   - \"Swamp\" might also carry cultural connotations, potentially referring to specific geographical locations known for swamps, such as the Everglades in Florida or the Bayou in Louisiana.\n   - There could be an exploration of the cultural, historical, or socio-economic significance of swamp regions.\n\n3. **Metaphorical or Symbolic Interpretations:**\n   - \"Swamp\" might be used metaphorically to describe complex or difficult-to-navigate scenarios, such as political \"swamps\" or bureaucratic challenges.\n   - The use of metaphor could suggest themes of overcoming adversity, strategic navigation, or governance.\n\n4. **Identity or Personhood \u2013 \"Izzo\":**\n   - If \"Izzo\" refers to an individual, there might be a narrative centered on this person's relationship with the thematic elements signified by the \"swamp.\"\n   - Alternatively, it could be a creative or fictional exploration of character development situated within the swamp context.\n\n### Arguments, Evidence, or Claims\n\n- Without explicit text, one may hypothesize that arguments could revolve around the importance of preserving swamp ecosystems, the unique challenges faced by those living or working in swamp regions, or strategies for navigating metaphorical swamps.\n- Evidence might include references to ecological data, cultural anecdotes, or case studies showcasing success in swamp management or survival stories.\n\n### Key Entities, People, or Organizations\n\n- **Individuals:**\n  - \"Izzo\" could refer to a key figure or a fictional character around whom the narrative is centered.\n  \n- **Organizations:**\n  - Environmental NGOs, conservation groups, or governmental bodies might be mentioned if the content pertains to ecological themes.\n\n- **Locations:**\n  - Specific swamp regions could be highlighted, potentially indicating regional focus in the content.\n\n### Conclusions or Recommendations\n\n- Potential conclusions might emphasize the need for continued conservation efforts, the value of swamps as essential ecological hubs, or strategies for effective navigation of metaphorical swamps.\n- Recommendations may include policy suggestions, calls for public awareness, or methods for personal or professional strategic management.\n\n### Overall Purpose and Intended Audience\n\n- **Purpose:**\n  - The content could aim to educate, inform, or inspire action regarding environmental preservation, cultural appreciation, or strategic problem-solving.\n  - It might also serve to entertain or provide insight into personal growth narratives.\n\n- **Intended Audience:**\n  - Individuals interested in environmental science, policy makers, cultural historians, or those seeking personal development guidance.\n  - Alternatively, the audience could include readers of fiction or creative narratives, intrigued by character-driven stories set in rich, symbolic landscapes.\n\n### Conclusion\n\nWhile the content titled \"Swamp Izzo\" remains largely undefined, it invites a multifaceted analysis that considers ecological, cultural, symbolic, and personal narrative dimensions. The interpretative exploration provides rich avenues for discussing environmental preservation, cultural heritage, and metaphorical strategies, all of which could resonate with distinct audiences depending on the thematic direction.",
  "sentiment": {
    "sentiment": "neutral",
    "score": 0,
    "confidence": 0.85,
    "rationale": "The analysis of 'Swamp Izzo' lacks explicit details that indicate a clearly positive or negative sentiment. The content appears to be more exploratory, focusing on multiple interpretations without definitive emotional biases. Therefore, it maintains a neutral stance with no evident strong emotional influence."
  },
  "metadata": {
    "topics": [
      "Environmental and Ecological Focus",
      "Cultural or Regional Significance",
      "Metaphorical or Symbolic Interpretations",
      "Identity or Personhood",
      "Conservation Strategies"
    ],
    "regions": [
      "Everglades",
      "Bayou",
      "Florida",
      "Louisiana"
    ],
    "commodities": [],
    "topic_details": {
      "main_topics": [
        "Environmental and Ecological Focus",
        "Cultural or Regional Significance",
        "Metaphorical or Symbolic Interpretations"
      ],
      "subtopics": [
        "Identity or Personhood",
        "Conservation Strategies"
      ]
    },
    "geographical_details": {
      "countries": [
        "Everglades",
        "Bayou",
        "Florida",
        "Louisiana"
      ],
      "regions": [],
      "cities": []
    },
    "commodity_details": {
      "resources": [],
      "products": [],
      "financial_instruments": []
    },
    "temporal_details": {
      "time_period": [],
      "key_dates": []
    },
    "entities": [
      "Izzo",
      "Environmental NGOs",
      "Conservation groups"
    ]
  },
  "timestamp": "2025-04-09T00:29:49.459563"
}