{
  "id": "d0e88f5e-3d9b-4f74-954b-e1078814008a",
  "source": "chinese century",
  "source_type": "direct_text",
  "text": "chinese century",
  "summary": "Search query: chinese century\n\n### Comprehensive Summary\n\nThe term \"Chinese Century\" refers to the notion that the 21st century could be dominated by the People's Republic of China, much like the 20th century is often considered the American Century due to the United States' global influence. This hypothesis is rooted in the rapid economic growth, technological advancements, and expanding geopolitical influence that China has experienced over recent decades. Proponents suggest that China's continued rise may lead to shifts in global power dynamics, with China potentially becoming the leading superpower economically, technologically, and politically.\n\nChina's strategic initiatives like the Belt and Road Initiative (BRI), increased military capabilities, and significant developments in sectors like technology and infrastructure underscore the potential for the 21st century to be characterized as the \"Chinese Century.\" Critics, however, point to challenges that could hinder China's growth, such as demographic changes, environmental issues, and international political resistance. Additionally, the Chinese government's policies on human rights and territorial claims remain points of contention in the international arena.\n\n### Main Themes, Arguments, or Points\n\n1. **Economic Dominance**: China has experienced unprecedented economic growth, becoming the world's second-largest economy. The argument is that continued growth may lead to China surpassing the United States in terms of economic output, strengthening its global influence.\n\n2. **Technological Advancements**: Investments in technology, Artificial Intelligence, and innovations in fields like 5G and renewable energy are positioning China as a leader in technological development.\n\n3. **Geopolitical Influence**: Through initiatives like the Belt and Road, China is expanding its influence across Asia, Africa, and Europe, establishing itself as a key player in global affairs.\n\n4. **Internal and External Challenges**: Factors such as an aging population, environmental policies, and international relations present significant challenges to China's anticipated dominance.\n\n### Key Entities Mentioned\n\n- **People's Republic of China (PRC)**: The central focus of the discourse surrounding the \"Chinese Century.\"\n- **Belt and Road Initiative**: A global development strategy adopted by China to enhance regional connectivity and embrace a brighter economic future.\n\n### Temporal Context\n\nPrimarily focused on the 21st century, with historical references to the American Century (20th century) as a comparative backdrop. Specifically, events and policies from the late 20th century till projections into the mid-21st century are relevant.\n\n### Geographic/Regional Focus\n\nThe primary focus is on China. The impact of China's growth extends to regions involved in the Belt and Road Initiative, including Asia, Africa, Europe, and parts of the Americas.\n\n### Overall Sentiment and Emotional Tone\n\nThe sentiment is cautiously optimistic, acknowledging China's achievements and potential while also considering the challenges it faces. There's a mix of awe at China's rapid rise and concern over the implications for global dynamics and internal governance issues.\n\n### Significant Facts, Statistics or Data Points\n\n- China is the world's largest trading nation in goods.\n- It hosts significant global tech giants like Huawei and Alibaba.\n- China has one of the largest military expenditures globally.\n- Challenges include an aging population projected to spike by 2050 and significant environmental pollution issues, despite their advancements in green technology.\n\nIn conclusion, the concept of the \"Chinese Century\" encapsulates both China's potential to reshape global dynamics and the multifaceted challenges that accompany such a transformation.",
  "sentiment": {
    "sentiment": "neutral",
    "score": 0.2,
    "confidence": 0.9,
    "rationale": "The analysis of the 'Chinese Century' is presented with a balanced overview of China's current and potential influence on global dynamics. The summary acknowledges China's significant economic growth, technological advancements, and geopolitical strategies, which contribute to its potential dominance. However, it also highlights considerable challenges such as demographic shifts, environmental issues, and international political resistance. The sentiment is termed 'cautiously optimistic,' which aligns with a neutral sentiment as it does not overly lean towards positive or negative extremes. The optimism about growth is tempered by concerns about sustainability and political issues, leading to a slightly positive score but overall neutrality in tone."
  },
  "metadata": {
    "topics": [
      "Economic Dominance",
      "Technological Advancements",
      "Geopolitical Influence",
      "Internal and External Challenges",
      "Belt and Road Initiative",
      "Global Power Dynamics",
      "Human Rights and Territorial Claims"
    ],
    "regions": [
      "China",
      "Asia",
      "Africa",
      "Europe",
      "Americas"
    ],
    "entities": [
      "People's Republic of China (PRC)",
      "Belt and Road Initiative",
      "Huawei",
      "Alibaba",
      "United States"
    ],
    "commodities": [
      "Technology",
      "Artificial Intelligence",
      "5G",
      "Renewable Energy",
      "Trade Goods",
      "Infrastructure",
      "Military Expenditure"
    ],
    "temporal_details": {
      "time_period": [
        "21st Century",
        "Late 20th Century",
        "Mid-21st Century"
      ],
      "recency": "current"
    },
    "topic_details": {
      "main_topics": [
        "Chinese Century",
        "Economic Growth",
        "Technological Leadership"
      ],
      "subtopics": [
        "Belt and Road Initiative",
        "Global Power Shifts",
        "Demographic Challenges",
        "Environmental Issues",
        "International Relations"
      ]
    }
  },
  "timestamp": "2025-04-09T01:30:55.464289"
}