{
  "id": "009fafcb-d446-4059-8ff5-63cbd25300d7",
  "source": "Direct Text Input",
  "source_type": "direct_text",
  "text": "New Disney snow white movie",
  "summary": "To perform a comprehensive analysis of the news surrounding the new Disney Snow White movie, let's delve into the various elements and dynamics at play:\n\n### Main Events or Developments\n\n1. **Announcement of the Project**: The new Snow White movie appears to be one of the latest entries in Disney's ongoing strategy to reimagine its classic animated features as live-action films. This development is part of Disney's broader effort to capitalize on its iconic brands by modernizing them for a new audience.\n\n2. **Casting Choices**: A significant point of interest likely revolves around the casting decisions. There may be discussions about the actors selected for key roles, particularly the protagonist, Snow White, and other principal characters such as the Evil Queen and Prince.\n\n3. **Creative Direction and Changes**: Modern reinterpretations often involve updates or changes to the original narrative or themes. The creativity and directorial direction, including choices for diversifying characters or altering plot points to reflect contemporary societal values, are critical talking points.\n\n4. **Release Dates and Production Timeline**: Information about filming schedules, release dates, and promotional strategies forms a core part of the news coverage.\n\n### Perspectives or Biases in the Reporting\n\n- **Enthusiastic Endorsement vs. Critical Skepticism**: Reporting may display enthusiasm about the film as an exciting addition to Disney's lineup, or there might be skepticism, particularly if the movie deviates significantly from the beloved original. Enthusiasts may highlight the artistic and technological advancement, while critics might focus on the risks of retelling a nostalgic story.\n\n- **Cultural Representation and Casting Controversies**: The current climate of sensitivity towards representation and diversity might introduce biases, with some reports emphasizing positive strides while others critique perceived shortcomings. This duality creates a spectrum of opinion from progressive endorsement to traditionalist dissent.\n\n### Key Persons, Organizations, or Entities\n\n- **Disney Studios**: The core organization involved, overseeing production and distribution of the film.\n\n- **Director and Screenwriters**: Artistic figures who shape the narrative and vision of the film, whose previous works and thematic approaches may be analyzed for insights into the movie’s potential direction.\n\n- **Actors and Cast**: Particularly the leads, whose previous roles and public personas contribute to public perception and media narratives.\n\n### Geographical Focus\n\nThe geographical focus would primarily be the United States, home to Disney's headquarters and a significant market for its films. However, international markets—particularly regions where Disney is investing in expanding its cultural footprint—could also figure prominently, especially in contexts of global casting or international box office projections.\n\n### Timing of Events\n\n- **Current Developments**: Recent casting announcements, previews, and production updates dominate the present landscape of the film's coverage.\n\n- **Historical Context**: Snow White as a character hails from a deep-rooted fairy tale tradition and as the first full-length Disney feature from 1937. This historical weight likely impacts current reporting.\n\n- **Future Predictions**: Speculation about future success at the box office, impact on Disney’s broader live-action slate, and how this film might pave the way for further adaptations as part of Disney’s long-term strategy will be prevalent.\n\n### Conclusion\n\nThe new Disney Snow White movie is a convergence of creative evolution, cultural discourse, and commercial strategy. Analysis of related news points to a dynamic interplay between nostalgia and modern storytelling, balancing audience expectations with innovative reinterpretations. The narrative surrounding its production and reception underscores broader trends in Hollywood regarding adaptation, representation, and global marketing strategies. Understanding these aspects provides a fuller picture of the film's anticipated role in Disney's cinematic legacy and the entertainment industry at large.",
  "sentiment": {
    "sentiment": "neutral",
    "score": 0,
    "confidence": 0.85,
    "rationale": "The analysis highlights a balanced mix of both enthusiastic endorsement and critical skepticism around the new Disney Snow White movie. The discussion of creative direction, casting choices, and cultural representation reveals a spectrum of opinions, indicating neither a predominantly positive nor negative sentiment overall."
  },
  "metadata": {
    "topics": [
      "Announcement of the Project",
      "Casting Choices",
      "Creative Direction and Changes",
      "Release Dates and Production Timeline",
      "Cultural Representation and Casting Controversies"
    ],
    "regions": [
      "United States"
    ],
    "commodities": [
      "Disney Snow White movie"
    ],
    "topic_details": {
      "main_topics": [
        "Announcement of the Project",
        "Casting Choices",
        "Creative Direction and Changes"
      ],
      "subtopics": [
        "Release Dates and Production Timeline",
        "Cultural Representation and Casting Controversies"
      ]
    },
    "geographical_details": {
      "countries": [
        "United States"
      ],
      "regions": [],
      "cities": []
    },
    "commodity_details": {
      "resources": [
        "Disney Snow White movie"
      ],
      "products": [],
      "financial_instruments": []
    },
    "temporal_details": {
      "time_period": [
        "1937",
        "Current Developments"
      ],
      "key_dates": []
    },
    "entities": [
      "Disney Studios",
      "Director",
      "Screenwriters",
      "Actors"
    ]
  },
  "timestamp": "2025-04-09T00:32:40.980695"
}